{
  "schema_version": 1,
  "target_ref": "refs/heads/main",
  "target_branch": "refs/heads/main",
  "target_remote": null,
  "target_sha": "aaaaaaaaaaaaaaaaaaaaaaaaaaaaaaaaaaaaaaaa",
  "now": "2026-09-12T12:00:00Z",
  "publication_verified": false,
  "authority_verified": false,
  "required_external_checks": ["current_target_and_expiry", "governor_authority", "publication", "publication_target", "record_urgency_and_obligations", "release_hold_authorization"],
  "scope": "explicit-sources",
  "sources": [
    {"source_id": "candidate:aaaaaaaaaaaaaaaaaaaaaaaaaaaaaaaaaaaaaaaa", "kind": "candidate", "requested_refs": ["HEAD"], "sha": "aaaaaaaaaaaaaaaaaaaaaaaaaaaaaaaaaaaaaaaa", "channel": "docs/coordination", "status": "read", "problem_ids": []},
    {"source_id": "target", "kind": "target", "requested_refs": ["main"], "sha": "aaaaaaaaaaaaaaaaaaaaaaaaaaaaaaaaaaaaaaaa", "channel": "docs/coordination", "status": "read", "problem_ids": []}
  ],
  "coverage": "COMPLETE",
  "holds": [],
  "records": [],
  "problems": []
}
